id,es,en
LM1,"Parece que alguien está dedicando su tiempo en el noble arte del adoctrinamiento y vaciado de cuerpos. Restos de personas, como pellejos, tal vez se parezcan más a mi ahora que cuando vivían.
","Parece que alguien está dedicando su tiempo en el noble arte del adoctrinamiento y vaciado de cuerpos. Restos de personas, como pellejos, tal vez se parezcan más a mi ahora que cuando vivían.
"
LM2,"Locos de un Dios maldito, aguardando a su señor, necesitaban de sus órdenes para continuar ,  es el  pútrido aire que necesitan sus pulmones. ","Locos de un Dios maldito, aguardando a su señor, necesitaban de sus órdenes para continuar ,  es el  pútrido aire que necesitan sus pulmones. "
CH1,"Todos los destinos de este viaje, todos!! Eran guijarros de rotas botellas,  unos de Whiskey, otros de Vodka … sabores amargos que  preceden  vómitos y diarreas.","Todos los destinos de este viaje, todos!! Eran guijarros de rotas botellas,  unos de Whiskey, otros de Vodka … sabores amargos que  preceden  vómitos y diarreas."
CH2,"Dónde estás mi fiel compañera, pasiva durmiente bajo la almohada. ","Dónde estás mi fiel compañera, pasiva durmiente bajo la almohada. "
